{
  "$schema": "https://json-schema.org/draft/2020-12/schema",
  "$id": "latent_comm:H01:v3",
  "type": "object",
  "required": [
    "schema_version",
    "versions",
    "U",
    "V",
    "bias",
    "alpha",
    "nonlinearity",
    "domain",
    "codomain",
    "scope",
    "target"
  ],
  "properties": {
    "schema_version": {
      "const": 3
    },
    "versions": {
      "type": "object",
      "properties": {
        "schema": {
          "type": "string",
          "pattern": "\\S"
        },
        "state": {
          "type": [
            "string",
            "null"
          ],
          "pattern": "\\S"
        },
        "ontology": {
          "type": [
            "string",
            "null"
          ],
          "pattern": "\\S"
        },
        "isa": {
          "type": [
            "string",
            "null"
          ],
          "pattern": "\\S"
        },
        "frame": {
          "type": [
            "string",
            "null"
          ],
          "pattern": "\\S"
        },
        "world": {
          "type": [
            "string",
            "null"
          ],
          "pattern": "\\S"
        },
        "task": {
          "type": [
            "string",
            "null"
          ],
          "pattern": "\\S"
        },
        "evidence": {
          "type": [
            "string",
            "null"
          ],
          "pattern": "\\S"
        }
      },
      "required": [
        "frame",
        "isa",
        "ontology",
        "schema"
      ],
      "additionalProperties": false
    },
    "U": {
      "type": "array",
      "items": {
        "type": "array",
        "items": {
          "type": "number"
        },
        "minItems": 1,
        "maxItems": 64
      },
      "minItems": 1,
      "maxItems": 64
    },
    "V": {
      "type": "array",
      "items": {
        "type": "array",
        "items": {
          "type": "number"
        },
        "minItems": 1,
        "maxItems": 64
      },
      "minItems": 1,
      "maxItems": 64
    },
    "bias": {
      "type": "array",
      "items": {
        "type": "number"
      },
      "minItems": 1,
      "maxItems": 64
    },
    "alpha": {
      "type": "number"
    },
    "nonlinearity": {
      "enum": [
        "identity",
        "tanh",
        "relu"
      ]
    },
    "domain": {
      "type": "string",
      "pattern": "\\S"
    },
    "codomain": {
      "type": "string",
      "pattern": "\\S"
    },
    "scope": {
      "type": "object",
      "properties": {
        "scope_id": {
          "type": "string",
          "pattern": "\\S"
        },
        "readers": {
          "type": "array",
          "items": {
            "type": "string",
            "pattern": "\\S"
          },
          "minItems": 0,
          "maxItems": 64
        },
        "writable_components": {
          "type": "array",
          "items": {
            "type": "string",
            "pattern": "\\S"
          },
          "minItems": 0,
          "maxItems": 64
        },
        "object_ids": {
          "type": "array",
          "items": {
            "type": "string",
            "pattern": "\\S"
          },
          "minItems": 0,
          "maxItems": 64
        },
        "expires_step": {
          "type": [
            "integer",
            "null"
          ],
          "minimum": 0
        }
      },
      "required": [
        "scope_id",
        "readers",
        "writable_components"
      ],
      "additionalProperties": false
    },
    "target": {
      "enum": [
        "working_slot",
        "residual"
      ]
    }
  },
  "additionalProperties": false
}
