{
  "schema_version": 3,
  "versions": {
    "schema": "3",
    "state": "s1",
    "frame": "f1",
    "ontology": "o1",
    "isa": "i1",
    "world": "w1",
    "task": "t1",
    "evidence": "e1"
  },
  "U": [
    [
      1.0
    ]
  ],
  "V": [
    [
      1.0
    ]
  ],
  "bias": [
    1.0
  ],
  "alpha": 1.0,
  "nonlinearity": "identity",
  "domain": "bound",
  "codomain": "bound",
  "scope": {
    "scope_id": "bound",
    "readers": [],
    "writable_components": []
  },
  "target": "working_slot"
}
